{
  "schema": "phase17-historical-gate-supersession-v1",
  "predecessor": {
    "commitSha": "07c7fcfcfea22c417c83ea7e9ffec6a6dcbd8467",
    "treeSha": "ae120ee345af105b5ccb9004dc2375a7541a9736",
    "ciUrl": "https://github.com/saroo98/kurdistan-protocol-compiler/actions/runs/31140567216",
    "ciConclusion": "success"
  },
  "artifacts": {
    "releaseApkSha256": "2bd10c95aee3b61cf40b817cc4131cbdcdaf0bce7f7e13539e01d99925236cf6",
    "internalApkSha256": "87a5cac5876038b58723625dc7deeac68160f11c96bd9009a738c2af226ecfc2",
    "mergedManifestSha256": "c8918a762d9e8ed3458b758ce19ca1634317cc58d041ca60edea72d9dbc84117"
  },
  "historicalVerifierSha256": "a7b3303c3c4bdd9866c023ad42c2de1b872096c2f68a6baeb0ce4c7c0bd2348b",
  "historicalTestInventorySha256": "5aebb2b87cf65011c6ac631f583dc65b0b8e82070260a383fc649f0469d4c82b",
  "supersededRules": [
    "release-manifest-forbids-internet-and-access-network-state",
    "current-runtime-is-loopback-only"
  ],
  "successorPolicySha256": "a2fc8a1e6f0ed0def65dac3e1c337711097db1bec525326c8984733c0c461a84",
  "successorGate": "phase17Gate"
}
